{
  "formato": 2,
  "libro": "Libro de ejemplo",
  "generado": "2026-10-15",
  "exportado": "2026-10-16T00:24:33.259Z",
  "anotaciones": [
    {
      "id": "amva86o6whjsbr",
      "tipo": "capitulo",
      "sid": "cap-01",
      "sidTitulo": "Capítulo 1. Hechos y observaciones",
      "nota": "Nota de la sección",
      "estado": "abierta",
      "creado": "2026-10-16T00:24:32.504Z",
      "editado": "2026-10-16T00:24:32.630Z",
      "libro": "2026-10-15",
      "autor": null
    },
    {
      "id": "amva86obx80xqd",
      "tipo": "pagina",
      "sid": "cap-01",
      "sidTitulo": "Capítulo 1. Hechos y observaciones",
      "nota": "Nota de la página 4",
      "estado": "abierta",
      "creado": "2026-10-16T00:24:32.685Z",
      "editado": "2026-10-16T00:24:32.806Z",
      "libro": "2026-10-15",
      "autor": null,
      "pagina": 4
    },
    {
      "id": "amva86o43ggp6s",
      "tipo": "subrayado",
      "sid": "cap-01",
      "sidTitulo": "Capítulo 1. Hechos y observaciones",
      "nota": "Definición tajante.",
      "estado": "abierta",
      "creado": "2026-10-16T00:24:32.403Z",
      "editado": "2026-10-16T00:24:32.403Z",
      "libro": "2026-10-15",
      "autor": null,
      "pid": "cap-01-b1",
      "src": "00_preliminares.md:23",
      "pagina": null,
      "bh": "2b1982a68760",
      "inicio": 0,
      "fin": 29,
      "cita": "Un hecho es lo que se observó",
      "antes": "",
      "despues": ", no lo que se concluyó de la ",
      "color": "duda",
      "sugerencia": "Un hecho es lo observado",
      "hilo": [
        {
          "de": "editor",
          "texto": "Quité «es».",
          "cierre": "atendida",
          "commit": "abc1234",
          "cuando": "2026-10-03T10:00:00.000Z"
        },
        {
          "de": "autor",
          "texto": "No era eso: falta el ejemplo.",
          "cuando": "2026-10-04T08:00:00.000Z"
        }
      ],
      "respuesta": "Añadí el ejemplo de la fiebre.",
      "cierre": "atendida",
      "commit": "def5678",
      "respondido": "2026-10-05T09:00:00.000Z"
    },
    {
      "id": "amva86ogun635d",
      "tipo": "general",
      "sid": null,
      "sidTitulo": null,
      "nota": "Nota general",
      "estado": "abierta",
      "creado": "2026-10-16T00:24:32.862Z",
      "editado": "2026-10-16T00:24:32.944Z",
      "libro": "2026-10-15",
      "autor": null
    }
  ]
}
